{
  "schema_version": "1.0.0",
  "modality": "visual",
  "evaluator": {
    "type": "agent",
    "agent": {
      "runtime": "claude-code",
      "model": "claude-opus-5"
    }
  },
  "evaluated_at": "2026-09-06T08:00:00Z",
  "calibration_ref": null,
  "profile_ref": "editorial/profiles/reference/visual.json",
  "basis": "model_inference",
  "authority_boundary": "craft_evidence_only",
  "evaluation_id": "eval:ft-visual-vocabulary-2026-09-06-01",
  "ref_id": "ref:ft-visual-vocabulary",
  "dimensions": [
    {
      "dimension": "hierarchy",
      "verdict": "adopt",
      "note": "The reference's own organising hierarchy is the transferable lesson: nine relationship families sit above the geometries, so selection starts from the relationship in the data rather than from a shape. This inverts the order the SUE-570 infographic used, which chose a 2x2 card layout first and poured relations into it.",
      "evidence": "README fetched and read 2026-09-06 (22,912 bytes). It carries 15 second-level sections; nine of them are relationship families — Deviation, Correlation, Ranking, Distribution, Change over Time, Part-to-whole, Magnitude, Spatial, Flow — and every concrete chart type appears only beneath one of those nine. The remaining six (General, Uncertainty, Animation, Interactivity, Map projections, Colour) are cross-cutting guidance rather than families."
    },
    {
      "dimension": "artifact-suitability",
      "verdict": "adopt",
      "note": "Authoritative for the relation-to-geometry selection METHOD, which bears on visual/analytical-graphic and visual/evidence-visual. Explicitly NOT authoritative for visual/body-infographic: the qualitative-structural relations a body infographic needs — causal-chain, authority, containment, correspondence — have no family here.",
      "evidence": "No section of the vocabulary covers a non-quantitative relation."
    },
    {
      "dimension": "composition",
      "verdict": "do_not_copy",
      "note": "FT chart furniture, proportions and house conventions are that publication's own expression. SUE-627's boundary forbids a named-publisher imitation objective, and the value taken here is a method, not a look."
    },
    {
      "dimension": "palette-colour-role",
      "verdict": "do_not_copy",
      "note": "FT's palette is a house identity. suengj.com colour roles are fixed by its own brand profile."
    },
    {
      "dimension": "semantic-density",
      "verdict": "neutral",
      "note": "The vocabulary is a selection aid rather than a rendered plate, so it carries no evidence about how much information one plate should hold."
    },
    {
      "dimension": "label-text-strategy",
      "verdict": "neutral",
      "note": "Not evidenced: the reference documents chart selection, not in-frame label policy."
    }
  ],
  "strengths": [
    "Organised by relationship first and geometry second, which is a reusable selection method independent of brand, subject and renderer.",
    "Publishes its README on a reachable host, so the taxonomy could be read directly rather than assessed from secondary description. The poster PDF and the site itself were NOT reachable, and the companion template repository's README is a short getting-started file with no chart code — so what was read is the taxonomy prose, not FT's implementations."
  ],
  "weaknesses": [
    "Covers quantitative relations only. Supplies nothing for causal chains, authority, containment or correspondence, which is the exact lane where SUE-570 failed.",
    "Says nothing about mobile behaviour, enclosure budget, or how a plate degrades at a narrow viewport."
  ],
  "applicable_to": {
    "content_types": [
      "research",
      "view",
      "news"
    ],
    "audiences": [
      "domain-expert",
      "domain-practitioner",
      "professional-generalist"
    ],
    "artifacts": [
      "visual/analytical-graphic",
      "visual/evidence-visual"
    ],
    "surfaces": [
      "suengj-com"
    ]
  },
  "provenance_class": "external",
  "notes": "Grade A for the taxonomy prose, which is what is adopted. Corrected 2026-09-06 after independent review: an earlier version implied the whole vocabulary including its templates had been inspected, and listed visual/body-infographic under applicable_to while the artifact-suitability note disclaimed exactly that family. A downstream selector reads applicable_to, not the note."
}
