{
  "schema_version": "1.0.0",
  "evaluation_id": "eval:openai-image-generation-2026-09-08-01",
  "ref_id": "ref:openai-image-generation",
  "modality": "visual",
  "evaluator": {
    "type": "agent",
    "agent": {
      "runtime": "codex",
      "model": "gpt-5"
    }
  },
  "evaluated_at": "2026-09-08T00:00:00Z",
  "profile_ref": "editorial/profiles/reference/visual.json",
  "basis": "model_inference",
  "dimensions": [
    {
      "dimension": "label-text-strategy",
      "verdict": "adopt",
      "note": "The guide's documented limitation on precise text placement supports a provider-neutral craft rule: mutable titles, citations, dense copy, and load-bearing values need an external or separately verified text route.",
      "evidence": "Source pointer ref:openai-image-generation; official guide observed 2026-09-08."
    },
    {
      "dimension": "hierarchy",
      "verdict": "adopt",
      "note": "The documented warning about layout-sensitive composition supports freezing the reading path and artifact hierarchy before generation rather than treating a prompt response as hierarchy authority.",
      "evidence": "Source pointer ref:openai-image-generation; official guide observed 2026-09-08."
    },
    {
      "dimension": "artifact-suitability",
      "verdict": "adopt",
      "note": "Useful as capability-boundary evidence for a generated visual lane, but not as evidence that a generated asset may carry article authority.",
      "evidence": "Source pointer ref:openai-image-generation; official guide observed 2026-09-08."
    }
  ],
  "strengths": [
    "Names concrete image-generation controls and limitations that can become adapter certification cases."
  ],
  "weaknesses": [
    "Documentation does not provide this repository's rendered pixels, digest, mobile derivative, or editorial acceptance result."
  ],
  "applicable_to": {
    "content_types": [
      "research",
      "view",
      "news"
    ],
    "audiences": [
      "general-reader",
      "professional-generalist",
      "domain-practitioner"
    ],
    "artifacts": [
      "visual/body-infographic"
    ],
    "surfaces": [
      "suengj-com"
    ]
  },
  "authority_boundary": "craft_evidence_only",
  "provenance_class": "external",
  "notes": "SUE-668 source/evaluation record. The direct URL and retrieval date are owned by ref:openai-image-generation; this evaluation carries no durable provider contract or article authority."
}
